{
  "schema_version": "0.1.0",
  "experiment_id": "replay-store-sales-001",
  "task_ref": "tasks/store-sales-replay/SPEC.md",
  "world_state_ref": "world-state/2026-10-09.json",
  "objective": "在固定 time_based 验证协议下重放多序列门店销量预测（3 店 x 180 天，promo/weekday 预制特征），验证重放确定性",
  "dataset_snapshot_ref": {
    "uri": "replays/store-sales-style/fixtures/train.csv",
    "sha256": "b7495bff49469667fa181061c07c79698d8c0ad84c03306d1299fb973d0e08e8",
    "rows": 540,
    "as_of": "2026-09-27T00:00:00Z",
    "label_cutoff": "2026-08-30T00:00:00Z"
  },
  "feature_set_ref": "replays/store-sales-style/fixtures#columns-v1",
  "validation_protocol_ref": {
    "strategy": "time_based",
    "n_folds": 1,
    "time_col": "date",
    "val_size_weeks": 4
  },
  "metric_definition_ref": {
    "name": "rmse",
    "direction": "minimize"
  },
  "baseline_ref": {
    "baseline_id": "replay-store-sales-baseline",
    "protocol_ref": {
      "strategy": "time_based",
      "n_folds": 1,
      "time_col": "date",
      "val_size_weeks": 4
    },
    "score": 4.0
  },
  "candidates": [
    {
      "candidate_id": "ridge-v1",
      "family": "ridge",
      "params": {
        "alpha": 1.0
      }
    },
    {
      "candidate_id": "hgb-v1",
      "family": "hgb",
      "params": {
        "max_iter": 150,
        "learning_rate": 0.08
      }
    }
  ],
  "hard_constraints": [
    {
      "type": "leakage",
      "description": "验证窗必须严格晚于训练窗，禁止未来标签进入训练",
      "check": "pipeline.splits.time_based_folds: max(train_time) < min(val_time)"
    }
  ],
  "budget": {
    "max_train_hours": 0.5,
    "max_runs": 8
  },
  "expected_artifacts": [
    "outputs/oof/replay-store-sales-001.csv"
  ],
  "authorization": {
    "authorized_by": "ghb",
    "authorization_ref": "auth/2026-10-09-replay-store-sales.md",
    "granted_at": "2026-10-09T08:00:00Z"
  },
  "source_ref": "human:ghb@2026-10-09",
  "created_at": "2026-10-09T08:00:00Z",
  "revision": 1,
  "content_hash": "a70adc745cb2cf33be3c775b9d94f7ab916623262a3066aafc73c2056129c22a"
}
